hash,id,broker
24871356-07d6-4be2-912c-d82d1ee0767a,22730,1 ANSWER INSURANCE SERVICES LTD
ab3d604f-26a7-41a9-a459-b1a1489808ce,22729,1 STOP INSURANCE CONSULTANTS LTD
70e99668-b849-4fd7-a6e9-f30f83b374c1,22041,2GETHER INSURANCE LTD
0e82a906-1344-419a-8157-cba1e7b9ada9,22232,4SURE WALES LLP
ee2033da-c1bf-4bda-82a6-b30683ec9b4e,23169,A C INSURANCE CONSULTANTS LTD
40db0c70-7d84-4c00-87ab-e492243423c5,23025,A K P INSURANCE SERVICES
36b72f6d-8e1d-4c0b-b08c-4ef7800cbd09,22743,A KERRY SERVICES LTD
98e929c3-2913-4d85-8990-d527a93aff81,21824,A MANNING UK LIMITED T/A MANNING UK
b0590af2-47da-4498-98c9-005263740280,23108,A ONE INSURANCE SERVICES (BMTH) LTD
1cdac37e-3edf-42a3-bb10-e81fdeee9dc2,88022,A R OWEN INSURANCE SERVICES LTD
3888f4b0-30f4-4881-8d3e-1dab350656cb,22777,A S INSURANCE SERVICES LTD
5299e0c5-3e6d-47f9-bd50-377e67f12aa9,22074,A Y S INSURANCE (A Y S FINANCIAL SERVICES T/A)
b44f7cfc-8c38-4787-b500-0d62815fb8ae,23288,A1 INSURANCE
95de4d8b-466b-4c21-bda5-cf336cd6782b,93162,ABACUS INSURANCE SERVICES
1d19984f-102c-41ca-9981-dbc4e5260fe0,21817,ABACUS KENT LTD
3395802a-7816-4916-b2fc-f7af7898f1eb,21673,ABBEY BOND LOVIS LTD
7794228e-1e02-4f20-b063-b4f291fa8754,75785,ABBEY BOND LOVIS LTD  T/A THE INSURANCE PARTNERSHI
6efcb6aa-b1f9-4648-b1b7-6cdb39313b8c,85848,ABBEY BOND LOVIS LTD T/A FULTON DOWNES & AGNEW
b734f7a5-3025-4c79-9303-335f05036a55,75393,ABBEYAUTOLINE
f3068327-c4ee-4d04-b581-1a8bb64f4a20,22303,ABBEYAUTOLINE
b5f0d376-9a7f-498f-b481-2da416f190e9,23139,ABBEYAUTOLINE
166e859c-fe76-4f43-a4c1-a0bbcf60465a,23215,ABBEYAUTOLINE NEWFORGE GB
1d2f663a-74cf-49d9-a623-3d2a8202598a,23214,ABBEYAUTOLINE NEWFORGE NI
542d3d5b-f7a9-4d14-81ae-41e094d22206,23285,ACADEMY INSURANCE SERVICES LTD
f31dee88-aaad-4866-a450-0b5636be2f3a,86426,ACADEMY INSURANCE SERVICES LTD - BASILDON
39856ff0-9144-4958-a953-6390f2e974f1,88720,ACADEMY INSURANCE SERVICES LTD - BASINGSTOKE
0884158c-8cdb-4e13-900f-8de5ab06a998,88796,ACADEMY INSURANCE SERVICES LTD - BRISTOL
92418159-7781-4ff9-a5a1-89e3a31ed924,21486,ACADEMY INSURANCE SERVICES LTD - CHIPPENHAM
143b62d2-14f8-49c4-8bf4-425eef49bd87,91194,ACADEMY INSURANCE SERVICES LTD - CLIFTON
1486ec7a-3631-4ed7-9654-eec620af89c6,22531,ACADEMY INSURANCE SERVICES LTD - COTTENHAM
ea0f8d51-6d67-485d-9695-160e025ff4f5,22862,ACADEMY INSURANCE SERVICES LTD - DUDLEY
97a828fd-80ca-4e89-8ce5-6794eb5be456,23072,ACADEMY INSURANCE SERVICES LTD - EAST BARNET
4686ea9d-c71a-4198-badd-27fc130ab432,85341,ACADEMY INSURANCE SERVICES LTD - EGHAM
62551c15-b6b2-4a88-96f4-57f9702b847c,85342,ACADEMY INSURANCE SERVICES LTD - ETON
6fa9165f-e5ba-4bb1-b829-c2596b87cf59,22415,ACADEMY INSURANCE SERVICES LTD - NEWBURY
ab1f804e-ecf7-44d2-9d31-a106c0e18ba6,85340,ACADEMY INSURANCE SERVICES LTD - READING
94dac2a0-951b-4b13-af88-071882434e9d,85339,ACADEMY INSURANCE SERVICES LTD - SWINDON
c690b4df-a558-48c3-881c-7925c70a6f7f,91302,ACADEMY INSURANCE SERVICES LTD - WOKINGHAM
e7d0f792-3d9b-4d66-ad1e-71d50780695e,22445,ACADEMY INSURANCE SERVICES LTD - YARDLEY
4421fa5c-3172-48a8-acd5-f82bb8356364,23114,ACADEMY INSURANCE SERVICES LTD (COVENTRY) TA GODIV
8ac2b6c8-b349-44b8-837c-230fa9cd85fd,75918,ACADEMY INSURANCE T/A GEOFFREY SIMMONS INSURANCE C
fa66f6ab-a8eb-43a9-b0c1-f3f87d9d2655,22008,ACADEMY INSURANCE T/A SAFEGUARD INSURANCE
12f571f6-7f91-42b5-bcfc-7b4d50dc1859,22033,ACORN TO OAKS FINANCIAL SERVICES LTD
0b8f1de8-9331-42b0-a93f-6a404a79dec2,89461,ACTIVE INSURANCE SERVICES
b9c536ab-506d-4fd5-9700-a346c382cb9f,23012,ADRIAN FLUX INSURANCE GROUP
0042ce24-ca1a-4530-a7b3-9e3d92b569ce,86602,ADVANCE INSURANCE AGENCIES LTD
c50a31f7-b5a4-4f9a-8484-6ff9dd12dca1,23352,ADVANCE INSURANCE AGENCIES LTD
a62991f8-8a01-456f-8e19-ccfa5702cc96,22658,ADVANCE INSURANCE SERVICES
23411e69-1ee2-4f25-b2f8-ba8de5f67019,92648,ADVANCE INSURANCE SERVICES (MIDLANDS) LTD
6dae720a-1ebb-4ce0-acfd-93ff2b4934b9,22474,ADVANCE SCHEMES LTD T/A ADVANCE INSURANCE SERVICES
91ccdb62-3426-43f4-9a14-d3646403343e,21122,ADVANTA RISK LTD
24205bb3-285a-447c-8480-9a4506322f47,23368,ADVISORY INSURANCE BROKERS LIMITED T/A APPLETONS
2f4ced49-68fe-46b2-a862-cd2ff5a9d9de,23116,ADVISORY INSURANCE BROKERS LIMITED T/A GUY PENN
a3a63c3b-83ab-44e6-b9c6-353457a58487,23118,ADVISORY INSURANCE BROKERS LIMITED T/A GUY PENN
600d879d-14c5-4583-9d1d-47400afdd1c9,23119,ADVISORY INSURANCE BROKERS LIMITED T/A GUY PENN
bcb21965-5fc6-4d01-936d-80c33386677d,21892,"ADVISORY INSURANCE BROKERS LIMITEDT/A FINCH (""FINC"
0e8577f4-c329-4e83-8130-7d4fee64a9c1,22801,"ADVISORY INSURANCE BROKERS LIMITEDT/A FINCH (""FINC"
152d6019-1d4d-47ee-8d1a-58b244c782f5,75487,ADVISORY INSURANCE BROKERS T/A THOMPSON & RICHARDS
01f60a58-d38e-4974-8339-e7df05bdb464,75967,ADVISORY INSURANCE BROKERS T/A THOMPSON & RICHARDS
52cde12c-cc5d-445d-9d07-0831ef565219,85406,ADVISORY INSURANCE BROKERS T/A THOMPSON & RICHARDS
9350284c-dfcb-4dae-aeea-f5b9e1b93c29,21525,AIBL T/A BENNETT CHRISTMAS (BNL)
a3b58015-6612-44d5-ae79-b0a13e51ebd6,23117,AIBL t/as Guy Penn (BNL)
d5268e73-629f-4c36-b73d-d63494d176fe,23203,AIRSPORTS INSURANCE BUREAU LIMITED
9e6e92b6-99ef-496b-b638-6151a96f7ce1,23212,ALAN & THOMAS INSURANCE BROKERS
73ac6e1f-f68d-4ec3-ba3d-4c618051667c,85123,ALAN BLUNDEN & CO LTD
5aa07b7a-f398-49e2-be6e-06633cee942c,89389,ALAN BOSWELL INSURANCE ADVISERS LTD
b3b0af80-4497-4aeb-b465-724e160eee76,75469,ALAN BOSWELL INSURANCE BROKERS LTD
007ab771-2ef1-455b-addd-08cde61b3d1c,86286,ALAN BOSWELL INSURANCE BROKERS LTD
663b84ec-dbc5-46c4-aa0a-7be921ef636e,85186,ALAN BROWN & CO LTD
7ba0d487-1c7e-4388-b9c9-50827c710855,85187,ALAN BROWN & CO LTD
1eb81d45-212d-4a28-930f-4da91972406c,85188,ALAN BROWN & CO LTD
b8cb44d3-1b88-4352-b453-2ccc59b200f5,23089,ALAN BROWN & CO LTD
ff04befc-23aa-4ede-9beb-9a0a02b21052,23190,ALAN BROWN & CO LTD
1795c2d3-200e-4896-a5f6-5bad861f247f,23274,ALAN BROWN & CO LTD
0ec31911-2008-403c-9d25-cc3d4cdd17a3,22438,ALAN GASTON + MARY GASTON T/A ALAN GASTON INSURANC
b5c6c973-3fce-431e-ac57-d7bc12248064,21645,ALFORD BURTON & CO
019ce3d5-c6a4-4c51-97b8-dde6f62a2ff1,86447,ALFRETON INSURANCE SERVICES LTD
7e68659b-52fa-4ab2-bf72-325fa7978a0b,22769,ALL INSURE SERVICES LTD
60f643e4-000d-47e4-923d-12f290b352e5,22865,ALLIANZ BUSINESS SERVICES LTD
762dbae1-e011-4141-a850-177a67662d09,21499,ALLIED INSURANCE SERVICES LTD
155fa564-8f23-4884-9688-de1720ca36c2,21851,ALLIED WESSEX WESTINSURE LTD
6b81721f-fd1a-4681-a2ef-17880f92d6e3,23121,ALTERNATIVE PROPOSITIONS LTD
e30afbe3-5399-49d6-b9cf-926109d553aa,22694,ALTERNATIVE PROPOSITIONS LTD T/A ALTERNATIVE INSUR
9935f416-d015-4aa8-904b-8d47f761d919,23062,ALVECHURCH INSURANCE SERVICES
cd464e65-7f84-46b0-b90e-5c3d89942e41,22291,AMA INSURANCE SERVICES LIMITED
8db6429c-348d-4d6a-be90-06a9dd5e1376,22404,ANAMI AGENCIES LTD T/A LG INSURANCE SERVICES
03aab065-82f3-406c-b1b5-471e767a71a3,21062,ANCHOR INSURANCE
7bcc4548-fe37-4047-a18f-fa6102c8f116,21958,ANCHOR INSURANCE SERVICES LTD
bad241f9-e1d3-4f43-bde5-126cf57659e2,21945,ANDERSON & CO
4a62a284-2351-4d5b-9bac-ae1ae58f8dc1,21016,ANDREW YULE LTD
eae6d6b1-6aa8-41e2-b4b0-f889a9d6cb3a,87217,ANGLESEY INSURANCE SERVICES
331c5fac-6e65-4e0b-9c0a-2dd9d6d7c1a2,84997,ANTHONY D EVANS (INSURANCE BROKERS) & CO LTD
e4e122f5-4fd3-4cd7-875f-653f7149367b,21516,ANTHONY FIDLER & CO
ad619e3f-616b-4034-8c26-a605de593cb9,23351,APPLE INSURANCE SERVICES LTD
8ae4c04d-c56d-4955-bdcc-ed63e40f4317,91813,APPLETON & GREEN LTD
cbf12bd7-95d7-48bb-8cba-14866d1375f0,23309,APRICOT INSURANCE SERVICES LIMITED
f710aaa0-ed30-482f-a2a6-0ef4a4bcb4e9,22019,ARISS INSURANCE SERVICES (ARISS LIMITED T/A)
66f251de-34c9-4943-a4d3-4d9bc6a407bd,21879,ARKWRIGHT INSURANCE BROKERS LTD
06ac4082-88f0-46c5-bb6f-181845636e40,21182,ARNOLD CLARK INSURANCE SERVICES LTD
2b1850c1-e2f2-48b7-b070-f706ef1f8292,91735,ASHGROVE INSURANCE SERVICES
4e44af69-b0e0-407f-9af2-4b5285ef76fc,22674,ASHGROVE INSURANCE SERVICES
adc0215a-73a5-4960-8c30-ad600a1dfa0d,22490,ASHLEY PAGE INSURANCE BROKERS LTD
14a3c006-dbe1-4ffc-9983-da330701b1ce,23226,ASHLEY RODWELL INSURANCE AGENCIES LTD
a1e2133c-ba32-4ea0-b9a6-3385fe5348d7,23237,ASTON & BRADLEY INSURANCE SERVICES LTD
e94d7e58-8a50-4c7d-ac72-6e2c227ee6fc,22817,ASTON SCOTT LTD
ca33162d-c4aa-4c57-b5c4-e6ee02526140,86218,ATLANTA1 INSURANCE SERVICES
17464f89-fdb8-4f2c-8d68-55919eaf7132,85362,ATOM INSURANCE BROKERS LTD
7bc25e04-3582-4289-9f9e-d47a2a9c8fed,23144,AUTOLINE DIRECT INSURANCE CONSULTANTS
c16ef76a-0b3a-4a82-b757-681638ec68e9,91967,AWC INSURANCE SERVICES LTD T/AS YOUR INSURANCE SHO
85c15b2a-d9bb-46cd-92c8-97891de3fba5,75419,AYNSLEY INSURANCE BROKERS
7916cbc6-f311-4964-81e4-ba3b5162d4c2,22247,B H K INSURANCE SERVICES LTD
e02cc827-2bd7-4a67-a5d9-3ae8ab800bc9,89067,B P INSURANCE BROKERS
863379a0-70dd-470c-8427-062d5626664f,89315,B P INSURANCE BROKERS
35a270da-75cf-4311-b9e4-3dccf06d067a,89316,B P INSURANCE BROKERS
361be12d-fb1a-4c57-b2c9-c3d3bf1422c9,89317,B P INSURANCE BROKERS
0244001c-1f0d-4965-bdf2-f50c3334f07b,22285,B PORTWOOD & CO LTD
98d86105-8191-4148-a8d3-03796ef2963e,21025,B T I C LTD T/A BRIAN THOMPSON INSURANCE CONSULTAN
58ffc363-dd1f-446c-b5c7-1f2ef37b0722,22424,BACKHOUSE INSURANCE BROKERS LTD
f71e3a19-6b80-40cf-a408-263e090bf019,22378,BALE INSURANCE (LEICESTER) LTD
c4831dc1-5a0f-4fc1-9d37-d73d4034f5be,75425,BALE INSURANCE BROKERS LTD
1abdc21b-9a47-4850-a961-2db83ab57bd9,23219,BARRIE OF DURHAM
e6d21d0d-54d8-4e70-9a71-3844954e6c1f,23358,BARROW HAZELL & COMPANY LTD
80398fd4-f23b-4997-bf0c-6de9d1111aa7,86486,BARRY GRAINGER LTD
649047ba-4148-4185-91bf-e005224f323c,22279,BARTS INSURANCE BROKERS LTD
3fbb3d72-4cec-4d31-abbc-044425b13491,23018,BAUSOR HALL ASSOCIATES
00ff3c59-d9a0-439c-8dec-5cbde2e8c148,22652,BCM ACQUISITIONS LIMITED (ACADEMY HEAD OFFICE)
f768796e-fa9f-48ef-b410-d8d5de5808d3,22707,BCM ACQUISITIONS LTD T/A DUNELM
ecde4cee-2f77-4d58-afcb-ba1eee8f8f69,21725,BEAUMONT LAWRENCE & CO LTD
d0ea08f1-997f-4e56-82ca-4564b5652ca9,23257,BECKET INSURANCE SERVICES T/A CDC INSURANCE
87a4943a-b43e-400d-a94e-e205c2c7279c,21823,BELL INSURANCE BROKERS LTD
8cf5331a-3e0f-4ba3-a88c-f9b0b57a4258,21707,BERESFORD I B LTD T/A BERESFORD INSURANCE BROKERS
004e3f30-2a2f-4d2f-b636-14329a708300,22484,BEST INSURANCE SERVICES LTD
b67a8c47-c846-4048-a086-5509db4dec2f,22871,BESTFORD & COMPANY LLP
6683f9db-435e-46e9-9e1e-dc532bfad5cd,21891,BICKLEY INSURANCE SERVICES LTD
cde4b107-44b1-4c43-b669-8076bdf55eff,88163,BISHOPS INSURANCE BROKERS
ce7feace-a080-41cc-8e63-97375dae7fc7,21683,BJP INSURANCE BROKERS LTD
dea4c109-3a8a-4262-8c73-3a560823c483,22049,BLACKROCK EXPRESS INSURANCE AND FINANCIAL SERVICES
a35fdb5f-ff40-4fde-a66c-d05b25ca925a,88619,BLANDS INSURANCE BROKERS LTD
833fc174-28c6-4705-9116-ae6ce853547b,21961,BLS INSURANCE SERVICES LTD
de0ff72b-c059-45d6-9791-9574c89f557b,21856,BLYTHIN & BROWN LTD
e671f918-ced2-4cf0-8c62-bd10cfd147fd,23130,BOLLINGTON INSURANCE BROKERS LTD
88268ca5-a183-4c48-8483-add03200d335,84925,BOND LOVIS INSURANCE BROKERS
bc5c7566-7d6c-440d-b117-41685959a80a,23267,BONSAI INSURANCE SERVICES
b516ccf8-4a4e-4aef-8e83-abc9dd38b013,21814,BOSTON INSURANCE SERVICES LTD
5c3461e7-83a6-4c3b-964d-889335fe5366,86420,BRADY INSURANCE SERVICES LTD
0ef1f227-d53c-433c-9f5b-fe0960ffbc50,22657,BRADY INSURANCE SERVICES LTD
8257dee0-a2c0-4a9a-8934-2ac69979ce40,23185,BRADY INSURANCE SERVICES LTD
e6ab4601-ddc0-4a88-9753-7a08be618728,21056,BRADY INSURANCE SERVICES LTD (M J HARVEY)
c9358f17-bea2-40b7-85d3-d5696fde15e1,22869,BRIAN MCGURGAN INSURANCE
34cb75fd-87b3-4be9-a88f-e4eb42ef734b,22656,BRIAN THORNHILL & SON INSURANCE BROKERS LTD
607f2944-8eb4-4979-8157-9231c233547c,22434,BRICKS & MOTOR INSURANCE BROKERS LIMITED
6a51a5bf-014e-4990-987b-5ce75f32f773,23051,BRIDGES INSURANCE BROKERS LTD
201f51fe-4b4c-48a0-a522-0a8d6e183329,22407,BRIGHTSIDE INSURANCE SERVICES LTD
55403a05-770b-41bb-a693-cb0ee5e7155f,22328,BRIGHTSIDE INSURANCE SERVICES LTD (
a148044d-c5d9-4db3-84f0-64d372635aac,21585,BRIGHTSIDE INSURANCE SERVICES LTD (MOTOR & HO
001d3cf5-ec69-45d3-9967-362fcafd48b1,22086,BRIGHTSIDE INSURANCE SERVICES LTD T/
85cadedd-74e2-41b2-a742-901330c36dc0,22322,BRIGHTSIDE INSURANCE SERVICES LTD T/A ONE BUSINESS
b0c58b5c-0926-4eb2-8210-a11243c792f4,22676,BRINSWORTH INSURANCE & FINANCIAL SERVICES (TRENDLO
eef85806-614d-4eb4-aaa5-fe5bea61e756,91637,BROADSURE DIRECT LIMITED
4b7861d5-01aa-41bb-8373-adcfdfbbced1,23262,BROKER EXPERTS LTD
491973b8-7df7-4dfb-be4a-a2280859a6b8,87185,BROMWICH INSURANCE (BLOXWICH)
355c82b2-0112-471e-907d-ac8f9a4529e4,86770,BROMWICH INSURANCE BUREAU LTD
59ba9fc3-eb39-411f-8a53-6a0a3e99565f,87187,BROMWICH INSURANCE BUREAU LTD
7e454ddc-6192-4c45-8e77-1ab9c26cc667,87188,BROMWICH INSURANCE BUREAU LTD
f9b72960-d678-4369-873a-a9fe8b317bcc,75479,BROOKS BRAITHWAITE & CO LTD
9c4f1b6c-e8aa-4c90-bb13-2847aa781288,23360,BROWN & BROWN INSURANCE BROKERS (UK) LIMITED T/A C
2a0f9d75-5afe-403c-847d-efc5b952aa5f,22891,BROWN & BROWN INSURANCE BROKERS (UK) LIMITED T/A W
c7034243-2356-4a46-ab69-dec74b592696,23327,BROWN BEVAN INSURANCE BROKERS
6d75fcdc-a8b3-4dfa-aca7-16acead33c0e,23355,BROWN&BROWN INSURANCE BROKERS (UK) LIMITED T/A HIG
8e7829ec-fce0-4ccf-8f8f-2becf0c3af9e,22519,BROWN&BROWN INSURANCE BROKERS (UK) LIMITED T/AS AL
76eb4d4f-e44f-4f9a-9226-f53372d66be6,23334,BROWN&BROWN INSURANCE BROKERS (UK) LIMITED T/AS AL
c8b310ce-f8ba-48d2-9825-9737d5faff4e,23350,BROWN&BROWN INSURANCE BROKERS (UK) LIMITED T/AS GR
553472df-e044-42de-9c25-d84c5c3f0caf,23307,BRUCE STEVENSON INSURANCE BROKERS LTD
f0c60095-6b1a-46d4-9b76-ecebc9279a47,21944,BRUFORD & VALLANCE INSURANCE SERVICES LTD
ce5da87e-2003-4225-8bd3-6e051eb09c9e,89607,BRUNEL INSURANCE SERVICES LTD
2da94af0-3243-4089-a116-932a7e0425fa,23302,BUCKINGHAM INSURANCE
14c1b4d4-e271-4efe-9837-229c6c9c57af,23061,BULLERWELL & CO LTD
b2b55cf9-3893-44d3-9e51-f908cd24251d,21083,BURROW HUMPHREYS LTD
9f7e5295-535a-443f-8548-01715530ea2c,22034,BURTON ASSOCIATES
7daab85c-4540-4d06-8b32-43de0aef1ac6,22485,BUSINESS INSURANCE SOLUTIONS LIMITED (BRANCH L)
2be202a5-b3ec-4416-9c89-cc7005d0db07,21825,BUSINESS INSURANCE SOLUTIONS LIMITED (BRANCH V)
e7d6c2ac-2185-4b1b-a3dd-db589142a775,21841,BUSINESS LINE INSURANCE SERVICES LTD
4726bbb9-00ad-4393-a3c2-90e03831fec6,22833,BUTTERWORTH SPENGLER SOUTH WEST LTD
f7df07db-43dc-44eb-a6c0-55ac8fa74c7c,21952,C & B INSURANCE SERVICES LIMITED
ca8778ac-3262-47c2-91f4-22c45a168e06,23033,C & M INSURANCE CONSULTANTS 2001
b6c5f866-25f2-4391-a81c-b359e61dc367,85361,C C FLINT & CO LTD
575f7ba1-82a2-4a92-bfb2-071bebd96c5a,85320,C C FLINT & CO LTD (GRP)
c583866e-7cd4-4006-9999-a7548bd4e7e8,22716,C P WALKER & SON
a5720803-80ca-49c6-a2b8-db91344afef3,22982,C R K MOTOR INSURANCE SERVICES LTD
30496d31-1b61-4d8f-b1cb-d7b5592ad16c,87931,CAITHNESS & CO LTD
661884b6-c73d-4d7a-bb03-534ea9e7686a,22017,CALCLUTH & SANGSTER (INSURANCE BROKERS) LTD
023bb84e-0982-4fe3-bf9f-7bc4f45e0bee,89604,CALEB ROBERTS INSURANCE SERVICES LTD
355d3dc9-d344-4176-9a23-d50946ff1431,89507,CALLAWAY & SONS LTD
83558a5c-c1d0-4bd8-b559-5aab90deaf4e,75504,CAMPBELL IRVINE (INSURANCE BROKERS) LTD
52c497d1-ddae-487d-a952-558b7a848825,21977,CANFIELD-PAYNE INSURANCE CONSULTANTS LIMITED
92e2b81f-c310-47da-a03d-15954b082691,23058,CARFINANCE247 LTD
2668f03d-409c-4097-887a-39e8ed37aee2,22847,CAROLE NASH INSURANCE CONSULTANTS LTD
deee46d9-2d38-47df-a128-d2e42c465c6b,91805,CARPOL INSURANCE CONSULTANTS LTD
70524876-1670-4725-8c5d-5aaf840425a1,23147,CASS STEPHENS
951ddf52-cebc-45aa-9920-a1189a30f589,21026,CASTLE INSURANCE SERVICES (NORTH EAST) LTD
78320cb8-ddb8-49bc-a590-feaf73ec38f7,22527,CETA INSURANCE LTD
d0bbf84c-5abb-4e3a-bbbe-f8031d0140d6,22739,CHALKWELL INSURANCE SERVICES LTD
7722b6bc-8b49-4409-aac4-a3d7c470f6cb,92990,CHAPMAN & STACEY LTD
2d181ee1-600b-4b1e-b79c-aa29033ccffd,86524,CHRIS KNOTT INSURANCE CONSULTANTS LTD
bb0a0138-a338-4ab9-bb71-33ee51ee77df,21968,CHRISTOPHER TRIGG LTD
f65bf006-2c2a-48d8-9733-63f8fd037124,22103,CHUBB INSURANCE BROKERS
a19e6ab8-ba32-4ad1-b4e7-f2a62e7a1e88,21804,CIP INSURANCE BROKERS LTD
0a13b803-d65f-4ac6-a83c-bebd9dcc1932,21004,CIP T/A DOUGLAS INSURANCE SERVICES
3cd98610-93c0-443c-9181-6ecda2a2de96,21923,CIRCLE INSURANCE SERVICES LTD
ba92ac09-0c12-459c-a4a3-118f1b091c56,91466,CITY BROKING LTD T/A CITY INSURANCE GROUP
56fe1c55-ed30-4e42-9d6d-8a758def4aa2,23229,CITYGATE INSURANCE SERVICES LTD
f3c1a492-0007-4a45-87d1-4a3b08bac678,23321,CLASSICLINE INSURANCE SERVICES LTD
9b833ce9-dac6-4567-bbdd-ec1febdacc4f,75481,CLEAR INSURANCE MANAGEMENT LTD
4d3882a8-683d-475c-9d18-da863502610a,21024,CLEAR INSURANCE MANAGEMENT LTD
def69e20-bd30-4ac2-a26b-73a29d651f8f,89482,CLEDDAU INSURANCE SERVICES LTD
7fe6ed33-e337-474e-876b-d90b9d96e76a,89484,CLEDDAU INSURANCE SERVICES LTD
316c2ddb-4183-4eb8-945a-fcc9991f558a,21997,COFTON INSURANCE SERVICES LTD
785dc19b-8b48-4c90-b14b-e25247771181,22264,COMMERCIAL INSURANCE BROKERS LTD
68ce74eb-dca5-45b5-80f1-f866f4b573eb,22479,COMPLETE COVER GROUP
9b1531af-d10b-4465-a40a-73ea68c81c9e,21877,COMPLETE COVER GROUP LTD
c982b3d2-8feb-4bd2-9665-f09c00fe88ed,21120,COMPLETE COVER GROUP LTD T/A COMPLETE CAR COVER
fbe0ddf7-f0da-4148-be14-15613b64fccd,93246,COMPLETE COVER GROUP LTD T/A COMPLETE CAR EXTRA+
03eed5b6-c9ff-4181-84b6-3a11bf90084f,23204,COMPLETE COVERGROUP
dc789a1b-5820-4002-98dc-9cf0f4021662,75546,CONNECT INSURANCE BROKERS LTD
5259dca0-b0af-47ff-a23f-89d3ae51e60a,84916,CONNECT INSURANCE BROKERS LTD
bdc3bb22-61c4-4ca0-ae75-f7064b63996b,23348,CORNMARKET INSURANCE SERVICES
0d570801-bcd8-4f66-9def-785e60a94cc8,89149,COUNTY INS CONS LTD T/A ANDERSON ASHCROFT (GRP)
26f10226-89c1-43ca-97a9-1f1b7e8ac46f,87536,COUNTY INSURANCE BROKERS LTD
7bddb793-57cc-418b-9a87-af17c4430462,21246,COUNTY INSURANCE CONSULTANTS
9f0f1e53-3bbe-4e5a-9657-f3a98f530205,21260,COUNTY INSURANCE CONSULTANTS LTD
65124ba9-c12c-4212-a1c4-ddd9fc095c20,22678,COUNTY INSURANCE CONSULTANTS LTD
e0ae256e-e984-411f-bb72-87b281dedf3a,22717,COUNTY INSURANCE CONSULTANTS LTD
02e65832-c971-4881-a6b1-1b88ec63b0f6,22718,COUNTY INSURANCE CONSULTANTS LTD
2d7fa332-e5e6-47db-843b-41d55bba626a,22806,COUNTY INSURANCE CONSULTANTS LTD
9e38336f-402b-41f6-a44f-43135a8d4beb,22978,COUNTY INSURANCE CONSULTANTS LTD
93651fe0-220f-4c68-a498-ae21ad100cd9,23109,COUNTY INSURANCE CONSULTANTS LTD
8e32bbbf-2e2d-4794-93d6-9437debfaee9,23270,COUNTY INSURANCE CONSULTANTS LTD
5260d740-9b8d-4ee1-990f-ddef05140efc,84372,COUNTY INSURANCE CONSULTANTS LTD (BRADY & JONES)
67041185-e991-4d9b-b80b-1b709dd64006,23166,COUNTY INSURANCE CONSULTANTS LTD T/A ARCHENFIELD I
3a588d91-ab75-4d73-b4ac-588fb6e16ba1,92772,COUNTY INSURANCE CONSULTANTS LTD T/A ARTHUR MARSH
d0e063e2-9796-45ea-afe1-492bcb42b55a,75602,COUNTY INSURANCE CONSULTANTS LTD T/A BARRY FENTON 
17546020-54a7-44a1-a0d5-7cff9a13bcc7,23172,COUNTY INSURANCE CONSULTANTS LTD T/A BRUCE EDWARDS
7d564962-70b0-4af6-b9c2-bac8cbb2cb1a,23281,COUNTY INSURANCE CONSULTANTS LTD T/A DOUGLAS INSUR
22405578-3bf8-4eae-97c2-eee73b2c4c67,23007,COUNTY INSURANCE CONSULTANTS LTD T/A GEORGE WILLIA
2f5e7e5d-a2fb-41df-b81b-1514ff046f41,75792,COUNTY INSURANCE CONSULTANTS LTD T/A MEADONS INSUR
91a59caf-9f7f-4b2a-aa5f-9fad706f289f,23305,COUNTY INSURANCE CONSULTANTS LTD T/A PG INSURANCE
c36cc276-f3ad-4914-aaf0-0d1b98119c92,21909,COUNTY INSURANCE CONSULTANTS LTD T/A PROTHEROE INS
32a26a56-e794-46c3-aae7-879bc2418d38,22805,COUNTY INSURANCE CONSULTANTS LTD T/A RAHON INSURAN
ee547674-a18c-4340-a7e8-5fc6094f2851,84904,COUNTY INSURANCE CONSULTANTS LTD T/A RAWLINS INSUR
6fc26d8d-d4f4-4d0f-8395-e5fbe36c0c72,75869,COUNTY INSURANCE CONSULTANTS LTD T/A RIDGE INSURAN
2c5ecfad-7f39-4e07-ae7b-53cb22b3abac,75894,COUNTY INSURANCE CONSULTANTS LTD T/A SAGAR INSURAN
0deac8fc-b65c-4565-8639-134dc0cfa7ed,23087,COUNTY INSURANCE CONSULTANTS LTD T/A SWINFORD INSU
d8ef62a7-3eff-44fb-8dd9-904e1e0984f9,22800,COUNTY INSURANCE CONSULTANTS LTD T/A WYE INSURANCE
f56584cf-7b32-4c65-99aa-354ce4e1b8e3,21805,COUNTY INSURANCE CONSULTANTS T/A CJN INSURANCE SER
ba45566f-0d73-410c-8e3d-3975aa7ff43f,90397,COUNTY INSURANCE CONSULTANTS T/A THOMPSON BROTHERS
1921c190-4c2d-4505-ac3a-fd26ec59f0b9,22854,COUNTY INSURANCE CONSULTANTS TA WREXHAM INSURANCE
c5b427c9-82c1-45db-bea4-b0e1eec89d79,21962,COUNTY INSURANE CONSULTANTS LTD T/A PROTHEROE INSU
e381fa74-c6c9-4070-a824-a87bea78b327,21395,COVERGUARD INSURANCE BROKERS
de886034-4bb3-4aca-981f-2f9ddb595706,75555,COVERWELL INSURANCE BROKERS LIMITED
7e47ad3f-db32-45ae-9be1-3a3687e558f0,23238,CROSSROADS INSURANCE SERVICES
9290d858-fdf1-4016-9405-3573ea86e03c,81017,CROWNSWAY INSURANCE BROKERS LTD
b83985ee-04a1-4014-9649-54f71775623c,86385,CROWTHORNE INSURANCE SERVICES LTD
516794d4-ba63-4629-8216-27423cc35aac,23181,CRS CONSULTANTS LTD
af8774f9-f6e5-4bdf-9227-8404d5b506ff,23080,CRYSTAL INSURANCE SERVICES LTD T/A CRYSTAL INSURAN
7ed0365b-0234-43dc-a356-5e46b4a38d30,23243,CURRAN CONNOLLY & CO
f74a1b45-2e7d-450c-a49a-b188c6ee34cb,22258,D & G INSURANCE SERVICES LTD
1d1c07d4-39cf-4530-9ed9-f1c1dbf5605d,93010,D B ALISON & PARTNERS
6e10c54f-3dff-4ff4-98f0-30726a927c11,21420,D J LAWRENCE & ASSOCIATES
b5727945-e894-45c4-af58-d25d2f8edcdc,21065,DAEHAN INSURANCE - (Paradise Financial Ltd)
42c40a80-b727-496f-9cf1-b89c443261a8,22880,DAINES KAPP INSURANCE BROKERS LTD
e49f0494-8172-4172-a1ad-df426a4220d4,21504,DAULBY READ LTD
23a51c0f-7c72-417d-a649-08e21908aca1,23293,DAULBY READ LTD T/A HORNBY SNAPE
2f7b3b5b-3757-4bc1-99a1-913187568456,23055,DAULBY READ LTD T/A MUCH ADO INSURANCE
dbde101a-90fa-4d9e-b8f1-9bd672987bb3,21408,DAVID AUDEN & ASSOCIATES
ae259fbd-ea57-4a2c-b89a-31a15743b457,23103,DAVID CHARLES INSURANCE SERVICES
91ff32e3-881b-4db5-83db-0efe51e038cd,22841,DAVID EDWARDS INSURANCE BROKERS LTD T/A EDWARDS IN
07d897e0-bca2-4488-b932-84b4d49d9b72,89258,DAVID HASKOLL LTD
589187ff-ce7f-41ac-93a6-a04c9f1d270f,23059,DAVID J KILLEN & CO (INS SERV) LTD
3685d8c9-6e5e-49e0-9241-4531389cd39a,76133,DAVID J MILLER INSURANCE BROKERS LTD
f081d90d-daf2-4829-9b7d-ab3f9648e247,93273,DAVID VAUGHAN & CO
a12326d4-0f9f-49d7-b51a-bbd3d2299de0,22452,DAVID WAIN INSURANCE SERVICES LTD
e29abd24-702a-4064-8dc5-69150a8bd41f,75569,DAVIES CRADDOCK LTD
4de99b3b-2cd1-4c6d-9707-ee186b585fe8,23361,DAVIES CRADDOCK LTD
6ee63b2c-5aa9-43dd-b52c-31535a60199d,75577,DEESIDE INSURANCE BROKERS LTD
55f286f4-a59a-4ea8-8ec8-aa384aace185,75997,DENNIS WATKINS & CO LTD
81eb44e6-dbc1-4328-bbba-00da21e43ac9,92827,DERVENSURE INSURANCE BROKERS
0bba1bf0-a0e9-4f81-b26e-cc18bf406245,22113,DEVON DIRECT INSURANCE SERVICES LTD
88bf206a-cee4-4cb3-a279-106e82b76394,22095,DIB INSURANCE LTD
cb87dfc7-f6b9-4d32-a018-1418a4f5542c,23277,DICKSON & CO (NI) LTD
f7c6bb95-17b3-43e5-8181-dec5148345d2,23325,DICKSON & CO (NI) LTD
cb6f7e81-0e32-445e-8aa8-0ce4bdb03b6f,21023,DIGNEY GRANT LTD
a7d15590-a847-4f0a-8d80-3e5ecb06399d,91462,DNA INSURANCE SERVICES LTD
f40f49a2-a5ba-4ee3-914f-e77ef7044f85,75584,DOBSON & HODGE LTD
6bbcc2a7-a67a-45b7-a637-28752197f483,23046,DONALD COPE & CO
db62e075-e7e4-4c33-a6a9-46562b571f91,21875,DRAYTON INSURANCE LTD T/A DRAYTON INSURANCE SERVIC
ca6d251b-2918-46ab-8ea2-7c6c6582b153,22524,DRS COMMERCIAL SERVICES LIMITED
f143d2b8-8821-45bb-be83-edcab0c5f7cb,81191,E A DAVIES & CO LTD
5b10355e-93b2-490a-a967-bf20c21d2a48,21508,E I C INSURANCE SERVICES LTD
9f8a05f6-11c8-46c4-b70b-ec3b04913258,22392,EAST PENNINE INSURANCE CONSULTANTS LTD (FLETCHER)
a60e9745-4045-4f3b-8e11-16a2c57b437e,21914,EASTWOOD & PARTNERS LTD
da8921a0-9795-44f6-b70e-f063650a7349,23182,EASTWOOD & PARTNERS LTD
d9627653-8da2-4002-852c-39d9196c4c76,22259,ECS INSURANCE BROKERS LTD
8bbcd66f-671b-458c-a8cf-06b98d55a0e9,22842,EDEN INSURANCE SERVICES LTD
b182732e-4f73-40a7-9abf-bf4791c0a160,87175,EDINBURGH RISK MANAGEMENT (GENERAL) LTD
2c6e0fe7-5f7f-44d4-94e8-c70292eb1511,23137,EDINBURGH RISK MANAGEMENT (GENERAL) LTD
f418caeb-c525-4dbd-be60-0b0288304a6e,23064,ELEY INSURANCE SERVICES LTD
2b3b5728-ebe2-491e-94f8-4f2b303f0366,21021,ELLIOTT SLOWTHER INS SERV LTD T/A A19 INSURANCE
2e940cdd-cf78-4026-a463-80926ea59989,23099,ELLIOTT WESTLAND INSURANCE BROKERS LTD
60130196-f5af-43a0-8377-5a029dc48f8b,22538,ELLIS DAVID LTD
0a2bd7c3-e6a7-4dee-9c04-ddb899318de6,76701,EMROSE (INSURANCE BROKERS) LTD
c00722c6-c1a1-4a2b-a5f9-4393fe12f016,22254,EMU INSURANCE & MORTGAGE BROKERS LTD
c47f79a5-c257-4706-a262-fafcfcf73bcf,23177,ERNE INSURANCE SERVICES
7d0ff546-e9ed-4474-8e06-b96c8ae1bef3,22523,ERSKINE MURRAY LIMITED
084eb6c6-1c8f-487e-9b37-85648a20a1dc,23034,ERSKINE MURRAY LTD
db4ae052-4657-4965-9025-628ddcfb336b,21121,ERYL JONES INSURANCE CONSULTANTS
53af37e0-fa2a-41dc-bf10-32248433d566,75595,ESSEX INSURANCE BROKERS LTD
ccaae7c6-604d-4529-a7e3-e6da8b2e96de,92626,EXCEL INSURANCE SERVICES
c9041411-91d5-4256-82a6-a81d12cf8a7e,23022,F R BALL INSURANCE LTD
c1c11142-e9d1-4459-bddc-7da6adf6c4ab,89530,FAIRWEATHER INSURANCE SERVICES CHESHAM)
7863a5f5-cd3b-4ad6-8d4e-93ebc1ce4f81,89855,FINCH COMMERCIAL INSURANCE BROKERS LIMITED T/A HUG
2b149f1a-d101-41da-81d9-47aa8f2233dd,75909,FINCH GROUP SHENE
6fd99100-00aa-43bd-a666-aeef9c1f333a,22363,FIRST INSURANCE SERVICES (FRESH INSURANCE SERVICES
f303a1a6-4049-4106-ac93-68279ba5fd76,21500,FIRTH & SCOTT
f1c0a522-f662-4240-b924-261d6f1473f5,21496,FOGARTYS INSURANCE SERVICES LTD
4ccbdaa8-9c29-4172-aa27-f0fbcb30147a,75612,FORD & COMPANY GENERAL INSURANCE BROKERS LTD
a98cc74d-2ece-4794-ae70-0bfb184f50ca,91465,FORTUNE INSURANCE SERVICES LTD
6f32cfd1-5430-44af-80db-5bdeef0790f0,89394,FRANK PICKLES (INSURANCE BROKERS) LTD
13d42004-878a-45cb-9993-f2cc7becc833,23135,FRESH INSURANCE
2e7057ce-9b0a-4212-8869-d64eb3cbc5a1,23236,FRESH INSURANCE - HOMESERVE
1ecf8fae-4f7f-4893-938e-15e52ed37b6e,21427,FRESH INSURANCE GROUP
db0b1e72-12b2-43dd-adfc-a86073111ada,23356,FRIAR STREET INSURANCE CONSULTANTS LTD
bb1becac-e79c-44dc-8712-d0d0c810f9a2,22837,FUW INSURANCE SERVICES LTD
cd210b6e-7afa-4bf0-a450-ebcce605fdc9,93185,G D ANDERSON & CO LTD
7b54a5cf-8383-4b10-8511-9332c8cea53f,21041,G D ANDERSON & CO LTD
ef43940e-d714-4f6a-b473-bf5fec4ca353,84221,G J SLADDIN & CO LTD
bfdfb1d5-76d9-4ed9-bd95-1be92c204b4f,92086,G M I INSURANCE SERVICES LTD
44bf84d0-81e5-4922-beee-6d7fe3b0e5d2,23180,G MOORE & CO LTD
